QuestionID,Task,Question,ResponseCorrect,ResponseIncorrect,SourceLink_single,SourceLink_multiple,ResponseLength,SourceLength,ErrorType,ErrorPosition
1,,How has Apple's total net sales changed over time?,"Based on the provided documents, Apple's total net sales have changed over time as follows:

- For the quarterly period ended June 25, 2022, the total net sales were $82,959 million. 
- For the quarterly period ended December 31, 2022, the total net sales were $117,154 million.
- For the quarterly period ended April 1, 2023, the total net sales were $94,836 million. 
- For the quarterly period ended July 1, 2023, the total net sales were $81,797 million. 

From these figures, it can be observed that there was an increase in total net sales from the quarter ended June 25, 2022, to the quarter ended December 31, 2022. However, there was a subsequent decrease in total net sales in the quarters ended April 1, 2023, and July 1, 2023.",,[2022Q3-2023-Q3 AAPL.pdf],"[2022 Q3 AAPL.pdf, 2023 Q1 AAPL.pdf, 2023 Q2 AAPL.pdf, 2023 Q3 AAPL.pdf]",128,,,
2,,"Has there been any significant change in Apple's operating expenses over the reported quarters? If so, what are the key drivers for this change?","Yes, there has been a change in Apple's operating expenses over the reported quarters. The key drivers for this change are increases in research and development (""R&D"") expense and selling, general and administrative expense. The growth in R&D expense is primarily driven by increases in headcount-related expenses.

For the third quarter of 2022, the total operating expenses were $12,809 million, with R&D expenses of $6,797 million and selling, general and administrative expenses of $6,012 million.

For the first quarter of 2023, the total operating expenses increased to $14,316 million, with R&D expenses of $7,709 million and selling, general and administrative expenses of $6,607 million.

For the second quarter of 2023, the total operating expenses were $13,658 million, with R&D expenses of $7,457 million and selling, general and administrative expenses of $6,201 million.

For the third quarter of 2023, the total operating expenses were $13,415 million, with R&D expenses of $7,442 million and selling, general and administrative expenses of $5,973 million.

The consistent increase in R&D expenses indicates the company's continued investment in innovation and product development. The selling, general and administrative expenses have also increased, although they saw a slight decrease in the third quarter of 2023 compared to the second quarter of 2023.",,[2022Q3-2023-Q3 AAPL.pdf],"[2022 Q3 AAPL.pdf, 2023 Q1 AAPL.pdf, 2023 Q2 AAPL.pdf, 2023 Q3 AAPL.pdf]",199,,,
3,,How has Apple's revenue from iPhone sales fluctuated across quarters?,"The revenue from iPhone sales for Apple has fluctuated across the quarters as follows:

- In the quarter ended June 25, 2022, the revenue from iPhone sales was $40,665 million. 
- In the quarter ended December 31, 2022, the revenue from iPhone sales was $65,775 million.
- In the quarter ended April 1, 2023, the revenue from iPhone sales was $51,334 million. 
- In the quarter ended July 1, 2023, the revenue from iPhone sales was $39,669 million. ",,[2022Q3-2023-Q3 AAPL.pdf],"[2022 Q3 AAPL.pdf, 2023 Q1 AAPL.pdf, 2023 Q2 AAPL.pdf, 2023 Q3 AAPL.pdf]",76,,,
4,,Can any trends be identified in Apple's Services segment revenue over the reported periods?,"Based on the provided documents, there is a trend of increasing revenue in Apple's Services segment over the reported periods. The net sales for Services have shown growth from each period to the next. Specifically:

- In the quarter ended June 25, 2022, Services net sales were $19,604 million.
- In the quarter ended December 31, 2022, Services net sales increased to $20,766 million.
- In the quarter ended April 1, 2023, Services net sales further increased to $20,907 million.
- Finally, in the quarter ended July 1, 2023, Services net sales again increased to $21,213 million.

This consistent increase over the reported periods indicates a positive trend in the revenue of Apple's Services segment.",,[2022Q3-2023-Q3 AAPL.pdf],"[2022 Q3 AAPL.pdf, 2023 Q1 AAPL.pdf, 2023 Q2 AAPL.pdf, 2023 Q3 AAPL.pdf]",110,,,
5,,Are there any notable changes in Apple's liquidity position or cash flows as reported in these 10-Qs?,"Based on the provided documents, there are no explicit details indicating notable changes in Apple Inc.'s liquidity position or cash flows between the quarterly reports. The documents provided do not contain specific financial data or comparative analysis that would allow for an assessment of changes in the company's liquidity or cash flows.",,[2022Q3-2023-Q3 AAPL.pdf],"[2022 Q3 AAPL.pdf, 2023 Q1 AAPL.pdf, 2023 Q2 AAPL.pdf, 2023 Q3 AAPL.pdf]",52,,,
6,,What legal proceedings or contingencies are disclosed in these 10-Qs and how might they potentially impact Apple?,"The legal proceedings disclosed in the provided 10-Q documents include the following:

1. Epic Games Lawsuit: Epic Games, Inc. filed a lawsuit against Apple Inc. in the U.S. District Court for the Northern District of California, alleging violations of federal and state antitrust laws and California's unfair competition law based on Apple's operation of its App Store. The District Court ruled in favor of Apple on most counts but found that certain provisions of Apple's App Store Review Guidelines violated California's unfair competition law and issued an injunction. The case was appealed to the U.S. Court of Appeals for the Ninth Circuit, which affirmed the District Court's ruling. Further appeals and requests for review are mentioned, including a potential appeal to the U.S. Supreme Court and the Circuit Court's stay of the injunction pending such appeal.

2. European Commission State Aid Decision: The European Commission issued a decision that Ireland granted state aid to Apple by providing tax opinions in 1991 and 2007 concerning the tax allocation of profits of the Irish branches of two Apple subsidiaries. The decision ordered Ireland to recover additional taxes from Apple for the period June 2003 through December 2014. Both Apple and Ireland appealed the decision to the General Court of the Court of Justice of the European Union, which annulled the decision. The European Commission appealed the annulment to the European Court of Justice, and a hearing was held with a decision expected in calendar year 2024.

These legal proceedings and contingencies could potentially impact Apple in several ways:

- The Epic Games lawsuit could lead to changes in Apple's App Store policies and practices, particularly regarding the prohibition of developers from including external links to purchasing mechanisms other than Apple in-app purchasing. If the injunction takes effect, it could impact Apple's App Store revenue and operating model.
- The European Commission State Aid Decision could result in Apple being required to pay additional taxes for the specified period if the appeal by the European Commission is successful. Apple believes it would be eligible to claim a U.S. foreign tax credit for a portion of any incremental Irish corporate income taxes potentially due related to the decision.

Both matters could have financial implications for Apple, including potential monetary liabilities and changes to business practices that could affect future revenue and profitability.",,[2022Q3-2023-Q3 AAPL.pdf],"[2022 Q3 AAPL.pdf, 2023 Q1 AAPL.pdf, 2023 Q2 AAPL.pdf, 2023 Q3 AAPL.pdf]",382,,,
7,,Has Apple engaged in any significant share repurchase activities in the reported quarters and what are the financial implications of these activities?,"Yes, Apple has engaged in significant share repurchase activities in the reported quarters. The financial implications of these activities include a reduction in the number of shares outstanding, which can lead to an increase in earnings per share (EPS) and potentially enhance shareholder value. The repurchase activities are as follows:

- In the quarter ended June 25, 2022, Apple repurchased 408 million shares of its common stock for $65.0 billion under a share repurchase program authorized by the Board of Directors.
  
- In the quarter ended December 31, 2022, Apple repurchased 133 million shares of its common stock under an authorized share repurchase program for $19.0 billion, excluding excise tax due under the Inflation Reduction Act of 2022.

- In the quarter ended April 1, 2023, Apple repurchased 262 million shares of its common stock under an authorized share repurchase program for $38.1 billion, excluding excise tax due under the Inflation Reduction Act of 2022.

- In the quarter ended July 1, 2023, Apple repurchased 365 million shares of its common stock for $56.1 billion, excluding excise tax due under the Inflation Reduction Act of 2022.

These repurchases are part of Apple's capital return program, which includes share repurchases and dividends, aimed at returning excess cash to shareholders.",,[2022Q3-2023-Q3 AAPL.pdf],"[2022 Q3 AAPL.pdf, 2023 Q1 AAPL.pdf, 2023 Q2 AAPL.pdf, 2023 Q3 AAPL.pdf]",204,,,
8,,What is the effective tax rate reported by Apple in these quarters and how does it compare across the periods?,"The effective tax rates reported by Apple in the provided quarters are as follows:

- For the quarter ended June 25, 2022, the effective tax rate was 15.7%.
  
- For the quarter ended December 31, 2022, the effective tax rate was 15.8%.

- For the quarter ended April 1, 2023, the effective tax rate was 14.9%.

- For the quarter ended July 1, 2023, the effective tax rate was 12.5%.

Comparing across the periods, the effective tax rate decreased from 15.7% in the quarter ended June 25, 2022, to 12.5% in the quarter ended July 1, 2023.",,[2022Q3-2023-Q3 AAPL.pdf],"[2022 Q3 AAPL.pdf, 2023 Q1 AAPL.pdf, 2023 Q2 AAPL.pdf, 2023 Q3 AAPL.pdf]",93,,,
9,,"Has Microsoft partaken in any substantial stock buyback programs in the reported quarters, and what are the economic consequences of these actions?","Yes, Microsoft has partaken in substantial stock buyback programs in the reported quarters. In the 2022 Q3, it is mentioned that as of October 20, 2022, $36.1 billion remained of the $60.0 billion share repurchase program approved on September 14, 2021. In the 2023 Q1, as of January 19, 2023, $31.5 billion remained of this share repurchase program. In the 2023 Q2, as of April 20, 2023, $18.7 billion remained of the share repurchase program. Finally, in the 2023 Q3, it is stated that as of October 19, 2023, Microsoft completed its acquisition of Activision Blizzard, Inc. and that $18.7 billion remained of the $60.0 billion share repurchase program.

The economic consequences of these stock buyback programs include a reduction in the number of outstanding shares, which can lead to an increase in earnings per share (EPS) and potentially increase the stock price due to the perceived increased value of each share. Additionally, buybacks can be viewed as a signal that the company believes its stock is undervalued and can be a way to return value to shareholders.",,,"[2022 Q3 MSFT.pdf, 2023 Q1 MSFT.pdf, 2023 Q2 MSFT.pdf, 2023 Q3 MSFT.pdf]",177,,,
10,,Are there any substantial alterations in Microsoft's debt configuration or interest expenses over these quarters?,"Yes, there have been substantial alterations in Microsoft's debt configuration and interest expenses over these quarters. Specifically:

1. The 2022 Q3 document, it is mentioned that as of June 30, 2022, Microsoft had no commercial paper issued or outstanding. However, in the 2023 Q1 document, it is noted that as of December 31, 2022, Microsoft had $18.7 billion of commercial paper issued and outstanding, with a weighted average interest rate of 5.4% and maturities ranging from 7 days to 190 days.

2. In the ""2023 Q2 MSFT.pdf"" document, it is stated that as of March 31, 2023, Microsoft had $25.8 billion of commercial paper issued and outstanding, with a weighted average interest rate of 5.4% and maturities ranging from 7 days to 190 days.

3. In the ""2023 Q3 MSFT.pdf"" document, it is indicated that as of September 30, 2023, Microsoft had short-term debt of $25.8 billion, which consists of commercial paper.

4. Regarding interest expenses, in 2022 Q3, Microsoft reports interest expense of $500 million for the quarter ended September 30, 2022. In 2023 Q1, Microsoft shows an interest expense of $496 million for the quarter ended December 31, 2022. The document from 2023 Q2 reports an interest expense of $496 million for the quarter ended March 31, 2023. Finally, the 2023 Q3 document shows an interest expense of $525 million for the quarter ended September 30, 2023.

These documents collectively indicate that there was an introduction of commercial paper in Microsoft's debt configuration after June 30, 2022, and an increase in interest expense by the quarter ended September 30, 2023.",,,"[2022 Q3 MSFT.pdf, 2023 Q1 MSFT.pdf, 2023 Q2 MSFT.pdf, 2023 Q3 MSFT.pdf]",257,,,
11,,What effective tax rate has Microsoft reported in these quarters and how does it differ from period to period?,"Microsoft reported the following effective tax rates for the quarters:

- For the quarter ended September 30, 2022, the effective tax rate was 19%.
  
- For the quarter ended December 31, 2022, the effective tax rate was 19% for the three months and 19% for the six months.

- For the quarter ended March 31, 2023, the effective tax rate was 19% for the three months and 19% for the nine months.

- For the quarter ended September 30, 2023, the effective tax rate was 18%.

The effective tax rate remained consistent at 19% for the quarters ended December 31, 2022, and March 31, 2023, for both the three-month and extended periods. However, there was a slight decrease to 18% for the quarter ended September 30, 2023.",,,"[2022 Q3 MSFT.pdf, 2023 Q1 MSFT.pdf, 2023 Q2 MSFT.pdf, 2023 Q3 MSFT.pdf]",123,,,
12,,"In what ways have Microsoft's inventory levels shifted during these quarters, and what does this suggest about their management of the supply chain?","During the quarters presented, Microsoft's inventory levels have shown fluctuations:

- In Q3 2022, the inventory was $3,742 million 
- In Q1 2023, the inventory decreased to $2,500 million 
- In Q2 2023, the inventory slightly increased to $2,877 million 
- In Q3 2023, the inventory further increased to $3,000 million 

The decrease in inventory from Q3 2022 to Q1 2023 suggests that Microsoft effectively managed its supply chain, possibly by reducing excess stock or improving inventory turnover. The subsequent increases in Q2 2023 and Q3 2023 could indicate a buildup of inventory in anticipation of higher demand, new product launches, or as a buffer against supply chain uncertainties.",,,"[2022 Q3 MSFT.pdf, 2023 Q1 MSFT.pdf, 2023 Q2 MSFT.pdf, 2023 Q3 MSFT.pdf]",108,,,
13,,Outline the risk elements associated with Microsoft's business and the evolution of these risks over the reporting timeframe.,"The risk elements associated with Microsoft's business and their evolution over the reporting timeframe are as follows:

1. Dynamic and Highly Competitive Industry: Microsoft operates in a rapidly changing industry characterized by frequent technological and business model changes. This requires continuous innovation and adaptation to maintain competitiveness.

2. Economic Conditions: Microsoft's performance is influenced by global macroeconomic factors, which can affect demand for its products and services.

3. Foreign Currency Risk: A significant portion of Microsoft's revenue and expenses are denominated in currencies other than the U.S. dollar, making it susceptible to foreign exchange rate fluctuations.

4. Manufacturing and Supply Chain: Microsoft relies on third-party manufacturers and a limited number of suppliers for components, which can lead to disruptions if these vendors fail to meet requirements or face extended disruptions.

5. Regulatory Compliance and Litigation: Microsoft is subject to various legal proceedings and claims, as well as compliance with laws and regulations worldwide, which can result in financial liabilities and impact business operations.

6. Taxation: Microsoft's tax obligations are influenced by many factors, including changes in tax laws, regulations, and interpretations in multiple jurisdictions.

Evolution of Risks:

- The competitive landscape has remained a consistent risk, with the need for innovation and adaptation continuing to be a key focus.
- Economic conditions have been highlighted as a risk, with specific mention of the correlation between Microsoft's performance and global macroeconomic factors.
- Foreign currency risk has been consistently reported, with the company's significant international operations exposing it to exchange rate volatility.
- Manufacturing and supply chain risks have been noted, particularly the reliance on third-party manufacturers and the limited number of suppliers for certain components.
- Regulatory compliance and litigation risks have evolved, with new legal proceedings and the potential impact of regulatory changes being reported.
- Taxation risks have been detailed, with the company facing challenges related to audits, transfer pricing, and changes in tax laws and regulations.

Throughout the reporting timeframe, Microsoft has consistently identified these risks and has taken steps to manage and mitigate their potential impact on the business.",,,"[2022 Q3 MSFT.pdf, 2023 Q1 MSFT.pdf, 2023 Q2 MSFT.pdf, 2023 Q3 MSFT.pdf]",329,,,
14,,How has NVIDIA's total net sales trended over time?,"NVIDIA's total net sales have shown the following trend over time:

- For the quarterly period ended October 30, 2022, the total net sales were $5,931 million.
- For the quarterly period ended April 30, 2023, the total net sales increased to $7,192 million.
- For the quarterly period ended July 30, 2023, the total net sales further increased to $13,507 million.
- For the quarterly period ended October 29, 2023, the total net sales reached $18,120 million.

This trend indicates a significant increase in NVIDIA's total net sales over the observed periods.",,,"[2022 Q3 NVDA.pdf, 2023 Q1 NVDA.pdf, 2023 Q2 NVDA.pdf, 2023 Q3 NVDA.pdf]",88,,,
15,,"Has there been a considerable shift in NVIDIA's operating costs over the reported quarters? If so, what are the main causes for this shift?","Yes, there has been a considerable shift in NVIDIA's operating costs over the reported quarters. The main causes for this shift include:

1. Acquisition Termination Cost: In the first quarter of fiscal year 2023, NVIDIA recorded an acquisition termination cost of $1.35 billion due to the termination of the Share Purchase Agreement whereby NVIDIA would have acquired Arm Limited from SoftBank. This one-time cost significantly impacted operating expenses for that period.

2. Stock-Based Compensation Expense: NVIDIA has experienced increases in stock-based compensation expenses, which are a part of operating expenses. For example, the stock-based compensation expense was $745 million in the third quarter of fiscal year 2022, and it increased to $979 million in the third quarter of fiscal year 2024.

3. Research and Development: There has been an increase in research and development expenses, which is a key component of operating expenses. For instance, research and development expenses were $1,945 million in the third quarter of fiscal year 2023 and increased to $2,294 million in the third quarter of fiscal year 2024.

4. Sales, General and Administrative Expenses: These expenses have also seen an increase. For example, they were $631 million in the third quarter of fiscal year 2023 and rose to $689 million in the third quarter of fiscal year 2024.

These factors contribute to the overall shift in NVIDIA's operating costs across the reported quarters.",,,"[2022 Q3 NVDA.pdf, 2023 Q1 NVDA.pdf, 2023 Q2 NVDA.pdf, 2023 Q3 NVDA.pdf]",223,,,
16,,Can any consistent trends be identified in NVIDIA's Data Center segment revenue across the reported periods?,"Yes, consistent trends can be identified in NVIDIA's Data Center segment revenue across the reported periods. The Data Center segment revenue has shown growth over the reported periods. Specifically:

- For the quarter ended October 30, 2022, the Data Center revenue was $3.83 billion.
- For the quarter ended April 30, 2023, the Data Center revenue increased to $4.28 billion.
- For the quarter ended July 30, 2023, the Data Center revenue further increased to $10.32 billion.
- For the quarter ended October 29, 2023, the Data Center revenue reached $14.51 billion.

This indicates a consistent upward trend in NVIDIA's Data Center segment revenue over the reported periods.
",,,"[2022 Q3 NVDA.pdf, 2023 Q1 NVDA.pdf, 2023 Q2 NVDA.pdf, 2023 Q3 NVDA.pdf]",103,,,
17,,What role have foreign exchange rates played in NVIDIA's financial outcomes? Please provide a breakdown for each reporting period.,"For the reporting period ending October 30, 2022, NVIDIA mentioned that the impact of foreign currency transactions related to foreign exchange rate risk was not significant for the third quarter and first nine months of fiscal year 2023.

For the reporting period ending April 30, 2023, NVIDIA stated that there had been no material changes to the foreign exchange rate risks described as of January 29, 2023.

For the reporting period ending July 30, 2023, NVIDIA again reported that there had been no material changes to the foreign exchange rate risks described as of January 29, 2023.

For the reporting period ending October 29, 2023, NVIDIA did not provide specific details regarding the impact of foreign exchange rates on their financial outcomes in the provided context.",,,"[2022 Q3 NVDA.pdf, 2023 Q1 NVDA.pdf, 2023 Q2 NVDA.pdf, 2023 Q3 NVDA.pdf]",123,,,
18,,What are the key changes in NVIDIA's liquidity status or cash flows as disclosed in these quarterly reports?,"In the 2022 Q3 report, NVIDIA's cash, cash equivalents, and marketable securities were reported as $20.34 billion, with a year-over-year decrease reflecting $8.04 billion in stock repurchases, partially offset by operating cash flow generation. The company returned $99 million to shareholders in the form of cash dividends.

In the 2023 Q1 report, cash, cash equivalents, and marketable securities increased to $15.32 billion, up from $13.30 billion a quarter ago, primarily due to operating cash flow generation. The company continued to return cash to shareholders through dividends, paying out $99 million during the first quarter.

In the 2023 Q2 report, NVIDIA's cash, cash equivalents, and marketable securities further increased to $15.55 billion. The company repurchased 7.5 million shares for $3.28 billion and paid $99 million in cash dividends during the second quarter.

In the 2023 Q3 report, the cash, cash equivalents, and marketable securities grew to $18.28 billion. The company repurchased 8.3 million shares for $3.72 billion and paid $99 million in dividends during the third quarter. Additionally, the company mentioned that it expects sales to China and other affected destinations to decline significantly in the fourth quarter of fiscal year 2024 due to new USG licensing requirements, although this decline is anticipated to be more than offset by strong growth in demand from other regions.

Overall, NVIDIA's liquidity has shown an increasing trend across the quarters, with significant cash flow generation and continued return of capital to shareholders through share repurchases and dividend payments. However, there is an expectation of a decline in sales to certain regions due to new export restrictions, which may impact future liquidity status and cash flows.",,,"[2022 Q3 NVDA.pdf, 2023 Q1 NVDA.pdf, 2023 Q2 NVDA.pdf, 2023 Q3 NVDA.pdf]",267,,,
19,,"Comparing the most recent quarter to previous ones, how has NVIDIA's investment in research and development changed and what might be the implications?","In the most recent quarter ended October 29, 2023, NVIDIA's investment in research and development (R&D) was $2.294 billion, as stated in the ""Condensed Consolidated Statements of Income"" within the 2023 Q3. Comparing this to the previous quarters:

- In the quarter ended July 30, 2023, R&D expenses were $2.040 billion.
- In the quarter ended April 30, 2023, R&D expenses were $1.875 billion.
- In the quarter ended October 30, 2022, R&D expenses were $1.945 billion.

The R&D investment has increased each quarter, from $1.945 billion in the quarter ended October 30, 2022, to $2.294 billion in the most recent quarter ended October 29, 2023. This indicates a continued and growing commitment by NVIDIA to innovate and develop new technologies, which could have implications such as the introduction of new products, the enhancement of existing products, and potentially maintaining or improving NVIDIA's competitive position in the market.",,,"[2022 Q3 NVDA.pdf, 2023 Q1 NVDA.pdf, 2023 Q2 NVDA.pdf, 2023 Q3 NVDA.pdf]",144,,,
