QuestionID,Task,Question,ResponseCorrect,ResponseIncorrect,SourceLink_single,SourceLink_multiple,ResponseLength,SourceLength,ErrorType,ErrorPosition
20,,"What legal proceedings or uncertainties are presented in NVIDIA's quarterly reports, and how might they potentially affect the company?","NVIDIA's quarterly reports mention several legal proceedings, specifically securities class action and derivative lawsuits. These include the putative securities class action lawsuit captioned 4:18-cv-07669-HSG, initially filed on December 21, 2018, in the United States District Court for the Northern District of California, titled In Re NVIDIA Corporation Securities Litigation. The lawsuit alleges that NVIDIA and certain executives violated the Securities Exchange Act by making false or misleading statements related to channel inventory and the impact of cryptocurrency mining on GPU demand. The district court dismissed the complaint, but the decision was partially reversed by the Ninth Circuit Court of Appeals. NVIDIA's petition for rehearing was denied by the Ninth Circuit.

Additionally, there are derivative lawsuits pending in the United States District Court for the Northern District of California and the United States District Court for the District of Delaware, asserting claims against certain officers and directors for breach of fiduciary duty and other violations based on similar allegations of false and misleading statements. A new derivative action was also filed on October 30, 2023, in the Court of Chancery of the State of Delaware.

NVIDIA has not recorded any accrual for contingent liabilities associated with these legal proceedings, based on the belief that liabilities, while possible, are not probable. However, the company acknowledges that any possible loss or range of loss cannot be reasonably estimated at this time. The ultimate outcome of these actions could potentially affect NVIDIA's operating results, liquidity, or financial position if liabilities are determined to be probable and estimable in the future.",,,"[2022 Q3 NVDA.pdf, 2023 Q1 NVDA.pdf, 2023 Q2 NVDA.pdf, 2023 Q3 NVDA.pdf]",254,,,
21,,"How have NVIDIA's inventory levels changed during these quarters, and what might this indicate regarding their supply chain management?","NVIDIA's inventory levels have shown fluctuations over the reported quarters:

- As of October 30, 2022, the inventory was reported at $4,454 million.
- As of April 30, 2023, the inventory decreased to $4,319 million.
- As of July 30, 2023, the inventory slightly decreased to $4,319 million.
- As of October 29, 2023, the inventory increased to $4,779 million.

The changes in inventory levels indicate that NVIDIA has been actively managing its inventory in response to demand and supply chain conditions. The initial decrease from October 2022 to April 2023 could suggest efforts to align inventory with demand or improve supply chain efficiency. The slight decrease by July 2023 indicates a continued trend of managing inventory closely. However, the increase in inventory by October 2023 suggests that NVIDIA may be anticipating higher demand or facing supply chain challenges that require holding more inventory. This could also be a strategic move to secure components amidst global supply chain uncertainties.",,,"[2022 Q3 NVDA.pdf, 2023 Q1 NVDA.pdf, 2023 Q2 NVDA.pdf, 2023 Q3 NVDA.pdf]",154,,,
22,,"Summarize the risk factors to NVIDIA's business, and describe how they have transformed throughout the reporting period.","Risk factors to NVIDIA's business include:

1. Demand and Supply: NVIDIA's ability to meet demand is affected by long manufacturing lead times and complex product transitions. The company faces risks in securing sufficient capacity and managing inventory levels to meet demand, which may lead to inventory provisions or impairments.

2. Product Transitions: The complexity of transitioning to new product architectures can impact demand forecasting and supply mix. This includes challenges in product qualification, potential quality issues, and the timing of customer purchases.

3. New Products and Business Models: NVIDIA's expansion into new use cases, applications, and services, such as AI models and cloud services, involves uncertainties in demand estimation and revenue generation.

4. Global Trade: USG licensing requirements and export controls, particularly those affecting China, have impacted and may continue to impact NVIDIA's ability to sell certain products in key markets, potentially reducing revenue.

5. Macroeconomic Factors: Inflation, interest rates, market volatility, and geopolitical developments can affect supply chain costs, employee wages, and the value of investments.

6. Legal Proceedings: NVIDIA is involved in legal actions, including securities class action and derivative lawsuits related to alleged false or misleading statements about channel inventory and cryptocurrency mining GPU demand. The outcomes of these proceedings could impact the company's financial position.

Throughout the reporting period, these risk factors have evolved, with an increased emphasis on the impact of global trade restrictions and the challenges associated with rapid growth in data center demand. NVIDIA has also highlighted the potential decline in sales to China due to new USG licensing requirements as a significant risk factor in the most recent reporting period.
",,,"[2022 Q3 NVDA.pdf, 2023 Q1 NVDA.pdf, 2023 Q2 NVDA.pdf, 2023 Q3 NVDA.pdf]",261,,,
23,,How has Intel's total net sales fluctuated over historical periods?,"Intel's total net sales have fluctuated as follows over the historical periods:

- For the quarterly period ended October 1, 2022, the total net revenue was $15.3 billion.
  
- For the quarterly period ended April 1, 2023, the total net revenue was $11.7 billion.

- For the quarterly period ended July 1, 2023, the total net revenue was $12.9 billion.

- For the quarterly period ended September 30, 2023, the total net revenue was $14.2 billion.

From these figures, we can observe that Intel's total net sales decreased from $15.3 billion in Q3 2022 to $11.7 billion in Q1 2023. There was an increase to $12.9 billion in Q2 2023, followed by another increase to $14.2 billion in Q3 2023.",,,"[2022 Q3 INTC.pdf, 2023 Q1 INTC.pdf, 2023 Q2 INTC.pdf, 2023 Q3 INTC.pdf]",116,,,
24,,What are the significant factors that have led to changes in Intel's gross margin in the latest 10-Q relative to past quarters?,"In the latest 10-Q for the quarter ended September 30, 2023, the significant factors that have led to changes in Intel's gross margin relative to past quarters include lower revenue, higher unit cost, and partially offset by a decrease in period charges. Specifically, the gross margin was impacted by lower revenue in the Client Computing Group (CCG), Data Center and AI (DCAI), and Network and Edge (NEX) segments. Additionally, there was a higher unit cost, partially offset by a decrease in period charges.

For comparison, in the previous quarters, the gross margin was also affected by similar factors such as lower revenue and higher unit costs, along with other specific one-time charges. For instance, in Q2 2022, there was an inventory impairment charge related to the wind-down of the Intel Optane memory business and a patent settlement charge, both of which were excluded from non-GAAP results.
",,,"[2022 Q3 INTC.pdf, 2023 Q1 INTC.pdf, 2023 Q2 INTC.pdf, 2023 Q3 INTC.pdf]",145,,,
25,,"Has there been a substantial shift in Intel's operating expenses over the reported quarters? If so, what have been the driving factors?","Yes, there has been a substantial shift in Intel's operating expenses over the reported quarters. The driving factors include:

1. In Q3 2022, operating expenses were $6,710 million, with restructuring and other charges amounting to $664 million, which included an inventory impairment of $559 million related to the wind-down of the Intel® Optane™ memory business.
   
2. In Q1 2023, operating expenses decreased to $5,476 million, with restructuring and other charges of $64 million.

3. In Q2 2023, operating expenses increased to $5,654 million, with restructuring and other charges of $200 million.

4. In Q3 2023, operating expenses decreased slightly to $6,026 million, but restructuring and other charges significantly increased to $816 million, which included a $401 million charge for an EC-imposed fine and a $353 million charge related to the termination of the agreement to acquire Tower Semiconductor.

The fluctuations in operating expenses are attributed to changes in research and development costs, marketing, general and administrative expenses, and significant restructuring charges, including inventory impairments, legal settlements, and charges related to the termination of business agreements.
",,,"[2022 Q3 INTC.pdf, 2023 Q1 INTC.pdf, 2023 Q2 INTC.pdf, 2023 Q3 INTC.pdf]",171,,,
26,,How has Intel's revenue from chip sales seen variations across the quarters?,"Intel's revenue from chip sales has seen the following variations across the quarters:

- In Q3 2022, the total revenue was $15.3 billion.
- In Q1 2023, the total revenue decreased to $11.7 billion.
- In Q2 2023, the total revenue was $12.9 billion.
- In Q3 2023, the total revenue further decreased to $14.2 billion.

These figures indicate fluctuations in Intel's revenue from chip sales, with a notable decrease from Q3 2022 to Q1 2023, a slight increase in Q2 2023, and then a decrease again in Q3 2023.
",,,"[2022 Q3 INTC.pdf, 2023 Q1 INTC.pdf, 2023 Q2 INTC.pdf, 2023 Q3 INTC.pdf]",85,,,
27,,Are there identifiable trends in Intel's Data Center Group or IoT segment revenues over the reported periods?,"Based on the provided documents, there is a trend of decreasing revenue in Intel's Data Center and AI (DCAI) operating segment over the reported periods:

- In Q3 2022, the DCAI revenue was $4.255 billion.
- In Q1 2023, the DCAI revenue decreased to $3.7 billion.
- In Q2 2023, the DCAI revenue further decreased to $3.814 billion.
- In Q3 2023, the DCAI revenue continued to decrease to $3.814 billion.

This indicates a consistent downward trend in the DCAI segment's revenue across the reported periods.

Regarding the IoT segment, it is not explicitly mentioned in the provided documents. However, the Network and Edge (NEX) operating segment, which may include IoT-related revenues, also shows a decreasing trend:

- In Q3 2022, the NEX revenue was $2.133 billion.
- In Q1 2023, the NEX revenue decreased to $1.5 billion.
- In Q2 2023, the NEX revenue further decreased to $1.450 billion.
- In Q3 2023, the NEX revenue continued to decrease to $1.450 billion.

This indicates a consistent downward trend in the NEX segment's revenue across the reported periods.",,,"[2023 Q1 INTC.pdf, 2023 Q2 INTC.pdf, 2023 Q3 INTC.pdf]",167,,,
28,,"How does Intel's research and development spending in the most recent quarter compare to previous quarters, and what could be the potential impacts?","In the most recent quarter, which ended on September 30, 2023, Intel Corporation reported research and development (R&D) expenses of $3.870 billion. Comparing this to previous quarters:

- In the quarter ended July 1, 2023, R&D expenses were $4.080 billion.
- In the quarter ended April 1, 2023, R&D expenses were $4.109 billion.
- In the quarter ended October 1, 2022, R&D expenses were $4.302 billion.

The R&D spending in the most recent quarter has decreased compared to the previous quarters. This reduction in R&D expenses could potentially impact Intel's ability to innovate and develop new technologies, which may affect its competitive position in the long term. However, it could also be a part of cost management strategies to improve operational efficiency and profitability.",,,"[2022 Q3 INTC.pdf, 2023 Q1 INTC.pdf, 2023 Q2 INTC.pdf, 2023 Q3 INTC.pdf]",120,,,
29,,"What legal proceedings or potential liabilities have been disclosed in Intel's 10-Qs, and how might they impact the company?","Intel's 10-Q filings disclose several legal proceedings and potential liabilities that could impact the company:

1. European Commission Competition Matter: Intel was found to have used unfair business practices in 2009, resulting in a €1.1 billion fine, which was annulled in January 2022. The EC appealed the annulment, and Intel may be obligated to pay approximately €593 million in default interest if the appeal is unsuccessful. The EC reopened its administrative procedure to determine a fine against Intel based on alleged conduct not annulled by the General Court.

2. Litigation Related to Security Vulnerabilities: Intel faces multiple lawsuits related to the ""Spectre"" and ""Meltdown"" security vulnerabilities identified in 2017. Plaintiffs claim to have been harmed by Intel's actions and/or omissions and assert various common law and statutory claims seeking monetary damages and equitable relief.

3. Litigation Related to 7 nm Product Delay Announcement: Following Intel's announcement of 7nm product delays in July 2020, multiple securities class action lawsuits were filed against Intel and certain officers. Plaintiffs allege that defendants violated federal securities laws by making false or misleading statements about the timeline for 7nm products.

4. Litigation Related to Patent and IP Claims: Intel is involved in IP infringement lawsuits, including those filed by VLSI Technology LLC, which involve claims that certain Intel products infringe others' IP rights. Adverse results could include substantial fines, penalties, costly royalty or licensing agreements, or orders preventing Intel from offering certain products or services.

5. EC-Imposed Fine: In the third quarter of 2023, Intel was charged a $401 million fine by the EC for an unspecified reason.

6. Termination of Agreement with Tower Semiconductor: Intel mutually agreed with Tower to terminate the acquisition agreement due to the inability to obtain required regulatory approvals in a timely manner, resulting in a $353 million termination fee charged to Intel in the third quarter of 2023.

These legal proceedings and potential liabilities could materially impact Intel's financial position, results of operations, cash flows, or overall trends. Unfavorable outcomes could result in substantial monetary damages, fines, or penalties, costly royalty or licensing agreements, or orders preventing Intel from selling certain products or engaging in certain business practices. Additionally, settlements could involve substantial payments.

Intel has accrued a charge of approximately $2.2 billion related to the VLSI litigation and has disclosed that while it disputes the claims and intends to defend against them vigorously, it cannot make a reasonable estimate of potential losses in excess of recorded amounts due to recent developments and future proceedings.",,,"[2022 Q3 INTC.pdf, 2023 Q1 INTC.pdf, 2023 Q2 INTC.pdf, 2023 Q3 INTC.pdf]",408,,,
30,,Are there any significant alterations in Intel's debt structure or interest costs over these quarters?,"Yes, there have been alterations in Intel's debt structure and interest costs over these quarters. Specifically:

1. In the first quarter of 2023, Intel issued a total of $11.0 billion aggregate principal amount of senior notes and amended its revolving credit facility agreements, extending the maturity dates.

2. In the third quarter of 2023, Intel remarketed $423 million aggregate principal amount of bonds and continued to have no borrowings outstanding under its revolving credit facilities. The company also settled in cash $3.9 billion of its commercial paper and had no outstanding commercial paper as of September 30, 2023.

3. Regarding interest costs, Intel capitalized $395 million in interest in the third quarter of 2023, which is part of the total $1.1 billion capitalized in the first nine months of 2023. This is an increase from the $220 million capitalized in the third quarter of 2022 and the $516 million in the first nine months of 2022.

These changes indicate a significant management of debt and interest costs within the observed quarters.
",,,"[2023 Q1 INTC.pdf, 2023 Q3 INTC.pdf]",167,,,
31,,Does Apple report any significant new business acquisitions or divestitures in these 10-Qs?,"No, Apple does not report any significant new business acquisitions or divestitures in the provided 10-Q documents.",,,"[2022 Q3 AAPL.pdf, 2023 Q1 AAPL.pdf, 2023 Q2 AAPL.pdf, 2023 Q3 AAPL.pdf]",17,,,
32,,How have Apple's inventory levels changed across these quarters and what might this indicate about their supply chain management?,"Apple's inventory levels have changed as follows across the quarters:

- As of June 25, 2022, the inventory level was $6,580 million.
- As of December 31, 2022, the inventory level increased to $6,820 million.
- As of April 1, 2023, the inventory level further increased to $7,482 million.
- As of July 1, 2023, the inventory level slightly decreased to $7,351 million.

The increase in inventory levels from June 25, 2022, to April 1, 2023, could indicate that Apple has been building up its inventory, possibly in anticipation of increased demand, new product launches, or as a strategy to mitigate potential supply chain disruptions. The slight decrease in inventory levels by July 1, 2023, might suggest that Apple has started to sell through its inventory, possibly due to successful sales or adjustments in production to align with demand.

These changes could indicate proactive supply chain management, where Apple is adjusting its inventory levels in response to anticipated market conditions, product lifecycle stages, or to ensure product availability amidst global supply chain challenges.",,,"[2022 Q3 AAPL.pdf, 2023 Q1 AAPL.pdf, 2023 Q2 AAPL.pdf, 2023 Q3 AAPL.pdf]",167,,,
33,,Are there any significant changes or new disclosures in Apple's accounting policies as reported in these 10-Qs?,"No, there are no significant changes or new disclosures in Apple's accounting policies as reported in these 10-Qs. The notes to the condensed consolidated financial statements in each of the provided 10-Q filings state that there have been no material changes to the Company's critical accounting estimates since the 2022 Form 10-K.",,,"[2023 Q1 AAPL.pdf, 2023 Q2 AAPL.pdf, 2023 Q3 AAPL.pdf]",52,,,
34,,"Summarize the risk factors to Apple's business, and how they have changed over the reporting period","The risk factors to Apple's business have not changed over the reporting period. The risk factors mentioned include various challenges and uncertainties that could potentially affect the company's business, reputation, results of operations, financial condition, and stock price. These risks encompass a wide range of issues such as macroeconomic conditions like inflation, interest rate changes, and currency fluctuations, which can have both direct and indirect impacts on the company's performance. Additionally, legal proceedings and the outcome of litigation, which are inherently uncertain, could also materially affect the company's financial condition and operating results if resolved unfavorably. However, there have been no material changes to these risk factors as per the information provided in the context documents.",,,"[2022 Q3 AAPL.pdf, 2023 Q1 AAPL.pdf, 2023 Q2 AAPL.pdf, 2023 Q3 AAPL.pdf]",116,,,
35,,"Have there been notable fluctuations in Microsoft's operational expenditures during the reported quarters? If so, what have been the principal factors behind these changes?","Yes, there have been notable fluctuations in Microsoft's operational expenditures during the reported quarters. The principal factors behind these changes include:

1. In the first quarter of fiscal year 2023, Microsoft recorded $800 million of employee severance expenses related to workforce reduction as part of an ongoing employee benefit plan. These expenses were included in general and administrative expenses and allocated to segments based on relative gross margin.

2. In the first quarter of fiscal year 2024, Microsoft's effective tax rate decreased primarily due to tax benefits from tax law changes, including the impact from the issuance of Notice 2023-55 by the IRS and U.S. Treasury Department, which delayed the effective date of final foreign tax credit regulations to fiscal year 2024 for Microsoft.

3. Microsoft's investments in infrastructure and devices, which are part of its operational expenditures, continue to increase its operating costs and may decrease its operating margins.

These factors are highlighted in the ""Management’s Discussion and Analysis of Financial Condition and Results of Operations"" sections of the quarterly reports for the respective periods.",,,"[2022 Q3 MSFT.pdf, 2023 Q1 MSFT.pdf, 2023 Q2 MSFT.pdf, 2023 Q3 MSFT.pdf]",172,,,
36,,How has Microsoft's revenue from Windows or Surface devices varied quarter to quarter?,"The revenue from Windows and Surface devices for Microsoft over the quarters provided in the context documents is as follows:

For Windows:
- In Q3 2022, Windows revenue was $5,313 million.
- In Q1 2023, Windows revenue was $5,567 million.
- In Q3 2023, Windows revenue was $5,567 million.

For Surface (Devices):
- In Q3 2022, Devices revenue was $1,448 million.
- In Q1 2023, Devices revenue was $1,125 million.
- In Q3 2023, Devices revenue decreased by 22% (specific revenue figure not provided in the context).",,,"[2022 Q3 MSFT.pdf, 2023 Q1 MSFT.pdf,2023 Q3 MSFT.pdf]",79,,,
37,,What patterns can be discerned from Microsoft's Cloud Services revenue throughout the reported periods?,"Microsoft's Cloud Services revenue has shown a consistent pattern of growth throughout the reported periods. Specifically:

- In the first quarter of fiscal year 2023, Microsoft Cloud revenue increased 24% to $25.7 billion.
- In the second quarter of fiscal year 2023, Microsoft Cloud revenue increased to $27.1 billion.
- In the third quarter of fiscal year 2023, Microsoft Cloud revenue increased to $31.8 billion.
- In the first quarter of fiscal year 2024, Microsoft Cloud revenue further increased by 24% to $31.8 billion.

This indicates a trend of growth in Microsoft's Cloud Services revenue over the reported periods.",,,"[2022 Q3 MSFT.pdf, 2023 Q1 MSFT.pdf, 2023 Q2 MSFT.pdf, 2023 Q3 MSFT.pdf]",94,,,
38,,What significant movements have been observed in Microsoft's liquidity status or cash flow as per the quarterly reports?,"In the quarterly reports provided, Microsoft's liquidity status and cash flow have shown the following significant movements:

1. Cash and cash equivalents increased from $13,931 million as of June 30, 2022, to $80,452 million as of September 30, 2023.
2. Net cash from operations increased from $23,198 million for the three months ended September 30, 2022, to $30,583 million for the three months ended September 30, 2023.
3. Financing activities showed a net cash used in financing of $(10,883) million for the three months ended September 30, 2022, compared to net cash from financing of $14,761 million for the three months ended September 30, 2023.
4. Investing activities showed a net cash used in investing of $(3,132) million for the three months ended September 30, 2022, compared to net cash from investing of $503 million for the three months ended September 30, 2023.

These movements indicate an overall increase in Microsoft's liquidity and positive cash flow over the period covered by the reports.",,,"[2022 Q3 MSFT.pdf, 2023 Q1 MSFT.pdf, 2023 Q2 MSFT.pdf, 2023 Q3 MSFT.pdf]",158,,,
39,,"How does Microsoft's research and development spending in the latest quarter stack up against prior quarters, and what are the potential repercussions?","In the latest quarter ended September 30, 2023, Microsoft's research and development spending was $6,659 million. Comparing this to prior quarters:

- For the quarter ended June 30, 2023, the spending was $6,984 million.
- For the quarter ended March 31, 2023, the spending was $6,984 million.
- For the quarter ended December 31, 2022, the spending was $6,844 million.
- For the quarter ended September 30, 2022, the spending was $6,628 million.

The research and development spending in the latest quarter has decreased when compared to the immediate past quarter (June 30, 2023) but has increased compared to the same quarter in the previous year (September 30, 2022).

The potential repercussions of the changes in research and development spending could include impacts on the company's ability to innovate and bring new products to market. An increase in spending could indicate a strategic investment in future technologies and products, which could lead to new revenue streams and maintain competitive advantage. Conversely, a decrease might suggest cost optimization efforts but could also impact the company's long-term growth if it leads to a slowdown in innovation.",,,"[2023 Q1 MSFT.pdf, 2023 Q2 MSFT.pdf, 2023 Q3 MSFT.pdf]",178,,,
