QuestionID,Task,Question,ResponseCorrect,ResponseIncorrect,SourceLink_single,SourceLink_multiple,ResponseLength,SourceLength,ErrorType,ErrorPosition
40,,"What legal actions or potential liabilities are revealed in the quarterly reports, and how could they influence Microsoft?","The quarterly reports reveal the following legal actions or potential liabilities that could influence Microsoft:

1. U.S. Cell Phone Litigation: Microsoft Mobile Oy, a subsidiary of Microsoft, is involved in lawsuits alleging that radio emissions from cellular handsets caused brain tumors and other adverse health effects. The outcome of these cases could potentially have a financial impact on the company if the court rules against Microsoft.

2. Irish Data Protection Commission Matter: The Irish Data Protection Commission (IDPC) is investigating a complaint against LinkedIn regarding whether its targeted advertising practices violated the European Union General Data Protection Regulation (GDPR). A preliminary draft decision by the IDPC proposed a fine, and Microsoft intends to challenge this decision. The final outcome could result in financial penalties and impact business practices.

3. Activision Blizzard Acquisition: Microsoft completed the acquisition of Activision Blizzard, Inc. for $61.8 billion, net of cash acquired. The purchase price allocation is not yet complete, and most of the purchase price is expected to be allocated to goodwill and other identifiable intangible assets. This acquisition could have a significant impact on Microsoft's financial statements and operations.

4. Other Contingencies: Microsoft is subject to various other claims and suits that arise in the ordinary course of business. While management believes these will not have a material adverse impact on the consolidated financial statements, there is inherent uncertainty, and management's view may change in the future.

5. IRS Audit and Notices of Proposed Adjustment (NOPAs): Microsoft is under audit by the IRS for tax years 2014 to 2017 and has received NOPAs for tax years 2004 to 2013, seeking an additional tax payment of $28.9 billion plus penalties and interest. Microsoft disagrees with the proposed adjustments and will contest the NOPAs. The resolution of these tax issues could have a material financial impact.

These legal actions and potential liabilities could influence Microsoft by affecting its financial position, resulting in monetary damages, fines, or requiring changes to business practices. The outcomes of these matters could also impact the company's reputation and future operations.",,,"[2022 Q3 MSFT.pdf, 2023 Q1 MSFT.pdf, 2023 Q2 MSFT.pdf, 2023 Q3 MSFT.pdf]",334,,,
41,,Has Intel reported any significant business acquisitions or divestitures in these quarterly reports?,"Yes, Intel reported significant business acquisitions and divestitures in these quarterly reports. Specifically:

1. In the ""2023 Q1 INTC.pdf"" report, Intel mentioned an agreement to acquire Tower Semiconductor Ltd. in a cash-for-stock transaction, which was expected to advance Intel's IDM 2.0 strategy. The acquisition was subject to regulatory approvals and customary closing conditions.

2. In the ""2023 Q2 INTC.pdf"" report, Intel announced that they mutually agreed with Tower to terminate the agreement to acquire Tower Semiconductor Ltd. due to the inability to obtain regulatory approval in a timely manner. Intel paid a termination fee in accordance with the terms of the agreement.

3. In the ""2023 Q3 INTC.pdf"" report, Intel confirmed the termination of the agreement to acquire Tower Semiconductor Ltd. and mentioned the mutual agreement to terminate due to the inability to obtain required regulatory approvals in a timely manner. Intel also announced a commercial agreement with Tower, where Intel will provide foundry services and manufacturing capacity through its New Mexico facility for 300 mm advanced analog processing.

Additionally, Intel discussed the divestiture of its NAND memory business. The first phase of the agreement with SK hynix Inc. to divest the NAND memory business was closed on December 29, 2021, for $9.0 billion in cash. The transaction is to be completed in two closings, with the first closing having occurred in the first quarter of 2022 and the second closing expected to be no earlier than March 2025.",,,"[2023 Q1 INTC.pdf, 2023 Q2 INTC.pdf, 2023 Q3 INTC.pdf]",235,,,
42,,"How have inventory levels at Intel changed over these quarters, and what might this suggest about their supply chain strategies?","Over the quarters provided in the context, Intel's inventory levels have shown fluctuations:

- In Q3 2022, the inventory level was $13.224 billion.
- In Q1 2023, the inventory level decreased to $12.993 billion.
- In Q2 2023, the inventory level further decreased to $11.984 billion.
- In Q3 2023, the inventory level slightly increased to $11.466 billion.

The decrease in inventory levels from Q3 2022 to Q2 2023 suggests that Intel may have been adjusting its supply chain strategies to align with current demand, possibly reducing production or improving inventory turnover to avoid overstocking. The slight increase in inventory in Q3 2023 could indicate a strategic buildup in anticipation of increased demand or as a buffer against supply chain uncertainties.",,,"[2023 Q1 INTC.pdf, 2023 Q2 INTC.pdf, 2023 Q3 INTC.pdf]",116,,,
43,,"Outline the risk factors for Intel's business, and how they have evolved over the reporting periods.","The risk factors for Intel's business as outlined in the provided documents include:

1. Changes in demand for Intel's products.
2. Changes in product mix.
3. Complexity and fixed cost nature of manufacturing operations.
4. High level of competition and rapid technological change in the industry.
5. Significant upfront investments in R&D, business, products, technologies, and manufacturing capabilities.
6. Vulnerability to new product development and manufacturing-related risks, including product defects or errata.
7. Risks associated with a highly complex global supply chain, including disruptions, delays, trade tensions, or shortages.
8. Sales-related risks, including customer concentration and the use of distributors and other third parties.
9. Potential security vulnerabilities in Intel's products.
10. Cybersecurity and privacy risks.
11. Investment and transaction risk.
12. IP risks and risks associated with litigation and regulatory proceedings.
13. Evolving regulatory and legal requirements across many jurisdictions.
14. Geopolitical and international trade conditions.
15. Debt obligations and the ability to access sources of capital.
16. Risks of large scale global operations.
17. Macroeconomic conditions, including regional or global downturns or recessions.
18. Impacts of the COVID-19 pandemic or similar events.
19. Other risks and uncertainties that may affect Intel's business.

Over the reporting periods, these risk factors have evolved to include specific geopolitical tensions, such as the impacts of Russia's war on Ukraine, recent events in Israel, and rising tensions between the US and China. Additionally, there is mention of Intel's relationships with certain sanctioned parties, indicating a potential impact from global sanctions and trade restrictions.

Intel's risk factors have also been updated to reflect the current macroeconomic environment, including persistent inflation and higher interest rates, which were specifically mentioned in the 2023 Q1 INTC.pdf document. The risk factors related to the COVID-19 pandemic have also been updated over time to reflect the ongoing and future responses to the pandemic's effects.

Overall, while the core risk factors have remained consistent, their descriptions have been updated to reflect the changing global economic, political, and health landscapes.",,,"[ 2022 Q3 INTC.pdf, 2023 Q1 INTC.pdf, 2023 Q2 INTC.pdf, 2023 Q3 INTC.pdf]",307,,,
44,,How has Amazon's total net sales changed over time?,"Amazon's total net sales have changed over time as follows:

- For the quarterly period ended September 30, 2022, the total net sales were $127,101 million.
- For the quarterly period ended March 31, 2023, the total net sales were $127,358 million.
- For the quarterly period ended June 30, 2023, the total net sales were $134,383 million.
- For the quarterly period ended September 30, 2023, the total net sales were $143,083 million.

This indicates a consistent increase in total net sales over the observed periods.",,,"[2022 Q3 AMZN.pdf, 2023 Q1 AMZN.pdf, 2023 Q2 AMZN.pdf, 2023 Q3 AMZN.pdf]",82,,,
45,,What are the major factors contributing to the change in Amazon's gross margin in the most recent 10-Q compared to the previous quarters?,"The major factors contributing to the change in Amazon's gross margin in the most recent 10-Q compared to the previous quarters include:

1. Macroeconomic factors, including inflation, increased interest rates, significant capital market and supply chain volatility, and global economic and geopolitical developments, which have direct and indirect impacts on the results of operations that are difficult to isolate and quantify.

2. Rising fuel, utility, and food costs, rising interest rates, and recessionary fears which may impact customer demand and the ability to forecast consumer spending patterns.

3. The current macroeconomic environment and enterprise customer cost optimization efforts impacting AWS revenue growth rates.

4. Changes in foreign exchange rates, which reduced net sales and cost of sales.

5. Increased product and shipping costs resulting from increased sales, partially offset by fulfillment network efficiencies.

6. Increased payroll and related expenses for personnel engaged in marketing and selling activities.

7. Increased payroll and related costs associated with technical teams responsible for expanding existing products and services and initiatives to introduce new products and service offerings, and an increase in spending on technology infrastructure.

8. Changes in the mix of products and services sold to customers and the mix of net sales derived from products as compared with services.

These factors are mentioned across the provided quarterly reports (2022 Q3, 2023 Q1, 2023 Q2, and 2023 Q3) in the ""Managements Discussion and Analysis of Financial Condition and Results of Operations"" sections.",,,"[2022 Q3 AMZN.pdf, 2023 Q1 AMZN.pdf, 2023 Q2 AMZN.pdf, 2023 Q3 AMZN.pdf]",229,,,
46,,"Has there been any significant change in Amazon's operating expenses over the reported quarters? If so, what are the key drivers for this change?","Yes, there has been a significant change in Amazon's operating expenses over the reported quarters. The key drivers for this change include:

1. Increased payroll and related expenses for personnel engaged in marketing and selling activities, as well as technical teams responsible for expanding existing products and services and initiatives to introduce new products and service offerings.
2. Increased spending on technology infrastructure, primarily driven by additional investments to support AWS business growth.
3. Increased product and shipping costs resulting from increased sales, partially offset by fulfillment network efficiencies.
4. Impairments of property and equipment and operating leases primarily related to physical stores and fulfillment network facilities.
5. Estimated severance costs primarily related to planned role eliminations.

These factors are reflected in the various components of operating expenses, such as cost of sales, fulfillment, technology and content (or technology and infrastructure), sales and marketing, and general and administrative costs.",,,"[2022 Q3 AMZN.pdf, 2023 Q1 AMZN.pdf, 2023 Q2 AMZN.pdf, 2023 Q3 AMZN.pdf]",143,,,
47,,How has Amazon's revenue from online retail services fluctuated across quarters?,"Amazon's revenue from online retail services, referred to as ""Net Sales: Online stores"" in their financial statements, has fluctuated across quarters as follows:

- For the quarter ended September 30, 2022, the revenue was $59,340 million.
- For the quarter ended March 31, 2023, the revenue was $56,455 million.
- For the quarter ended June 30, 2023, the revenue was $56,575 million.
- For the quarter ended September 30, 2023, the revenue was $63,171 million.

This data indicates a decrease in revenue from Q3 2022 to Q1 2023, a slight increase in Q2 2023, and then a more significant increase in Q3 2023.",,,"[2022 Q3 AMZN.pdf, 2023 Q1 AMZN.pdf, 2023 Q2 AMZN.pdf, 2023 Q3 AMZN.pdf]",98,,,
48,,Can any trends be identified in Amazon's AWS (Amazon Web Services) segment revenue over the reported periods?,"Yes, trends can be identified in Amazon's AWS segment revenue over the reported periods. The AWS segment revenue has shown growth as follows:

- For the three months ended September 30, 2022, the AWS segment revenue was $20,538 million.
- For the three months ended December 31, 2022, the AWS segment revenue was $21,354 million.
- For the three months ended March 31, 2023, the AWS segment revenue was $22,140 million.
- For the three months ended June 30, 2023, the AWS segment revenue was $23,059 million.
- For the three months ended September 30, 2023, the AWS segment revenue was $23,059 million.

This indicates a consistent upward trend in AWS segment revenue across the reported periods.",,,"[2022 Q3 AMZN.pdf, 2023 Q1 AMZN.pdf, 2023 Q2 AMZN.pdf, 2023 Q3 AMZN.pdf]",111,,,
49,,Are there any notable changes in Amazon's liquidity position or cash flows as reported in these 10-Qs?,"Yes, there are notable changes in Amazon's liquidity position and cash flows as reported in the provided 10-Qs. Specifically:

1. Cash and cash equivalents increased from $30,177 million as of September 30, 2022, to $49,605 million as of September 30, 2023.
   
2. Net cash provided by operating activities increased from $39,665 million for the twelve months ended September 30, 2022, to $71,654 million for the twelve months ended September 30, 2023.

3. Net cash used in investing activities decreased from $(39,360) million for the twelve months ended September 30, 2022, to $(37,232) million for the twelve months ended September 30, 2023.

4. Net cash provided by (used in) financing activities changed from $6,532 million for the twelve months ended September 30, 2022, to $(9,133) million for the twelve months ended September 30, 2023.

These changes indicate an improvement in Amazon's liquidity position, with an increase in cash and cash equivalents and operating cash flows, a decrease in cash used for investing activities, and a shift from cash provided by financing activities to cash used in financing activities over the reported periods.",,,"[2022 Q3 AMZN.pdf, 2023 Q1 AMZN.pdf, 2023 Q2 AMZN.pdf, 2023 Q3 AMZN.pdf]",177,,,
50,,How does Amazon's R&D expenditure in the most recent quarter compare to previous quarters and what implications might this have?,"In the most recent quarter ended September 30, 2023, Amazon's R&D expenditure, categorized under ""Technology and infrastructure"" within operating expenses, was $21,203 million. Comparing this to previous quarters:

- For the quarter ended June 30, 2023, the R&D expenditure was $21,931 million.
- For the quarter ended March 31, 2023, the R&D expenditure was $20,450 million.
- For the quarter ended September 30, 2022, the R&D expenditure was $19,485 million.

The R&D expenditure in the most recent quarter shows a slight decrease from the previous quarter (Q2 2023) but an increase compared to the same quarter of the previous year (Q3 2022). This indicates a continued investment in innovation and technology development, which is essential for maintaining competitive advantage and driving future growth. However, the slight decrease from the previous quarter could suggest a more cautious approach possibly due to economic conditions or strategic realignment.",,,"[2022 Q3 AMZN.pdf, 2023 Q1 AMZN.pdf, 2023 Q2 AMZN.pdf, 2023 Q3 AMZN.pdf]",141,,,
51,,What legal proceedings or contingencies are disclosed in these 10-Qs and how might they potentially impact Amazon?,"The legal proceedings and contingencies disclosed in the 10-Qs include:

1. Claims, proceedings, and litigation related to various non-income taxes, such as sales, value added, consumption, service, and similar taxes, in jurisdictions where Amazon already collects and remits these taxes. These controversies typically relate to the taxability of products and services, collection and withholding on transactions with third parties, and compliance with reporting obligations. The final outcome of these controversies could be materially different from expectations.

2. Claims, proceedings, and litigation involving patent and other intellectual property matters, taxes, labor and employment, competition and antitrust, privacy and data protection, consumer protection, commercial disputes, goods and services offered by Amazon and third parties, and other matters.

3. Specific legal proceedings mentioned include:
   - Frame-Wilson v. Amazon.com, Inc. and similar cases alleging price fixing arrangements between Amazon and vendors and third-party sellers, monopolization, and consumer protection and unjust enrichment claims.
   - The Federal Trade Commission (FTC) and state Attorneys General lawsuit alleging Amazon has a monopoly in markets for online superstores and marketplace services and maintains those monopolies through anticompetitive practices.
   - Wilcosky v. Amazon.com, Inc. and similar cases alleging violations of the Illinois Biometric Information Privacy Act related to Amazon's collection, storage, use, retention, and protection of biometric identifiers.
   - Kove IO, Inc. v. Amazon Web Services, Inc. alleging patent infringement related to Amazon S3 and DynamoDB.
   - Dialect, LLC v. Amazon.com, Inc. and Amazon Web Services, Inc. alleging patent infringement related to Amazon's Alexa-enabled products and services.

These legal proceedings and contingencies could potentially impact Amazon by resulting in financial losses due to damages, fines, or settlement costs; changes in business practices; reputational harm; and increased legal and compliance costs. Additionally, adverse outcomes could lead to injunctions or other restrictions on Amazon's business operations.",,,"[2022 Q3 AMZN.pdf, 2023 Q1 AMZN.pdf, 2023 Q2 AMZN.pdf, 2023 Q3 AMZN.pdf]",290,,,
52,,Has Amazon engaged in any significant share repurchase activities in the reported quarters and what are the financial implications of these activities?,"Yes, Amazon has engaged in significant share repurchase activities. In the first quarter of 2022, Amazon repurchased 46.2 million shares of its common stock for $6.0 billion under its repurchase program authorized by the Board of Directors in March 2022. This program replaced the previous $5.0 billion stock repurchase authorization approved by the Board of Directors in February 2016. As of September 30, 2023, Amazon had $6.1 billion remaining under the repurchase program. There were no repurchases of common stock during the nine months ended September 30, 2023.

The financial implications of these activities include a reduction in cash and cash equivalents due to the funds used for the repurchase. The repurchase also reduces the number of outstanding shares, which can potentially increase the earnings per share (EPS) and return value to shareholders. The treasury stock account on the balance sheet increases with the cost of the repurchased shares, reflecting a reduction in stockholders' equity.",,,"[2022 Q3 AMZN.pdf, 2023 Q1 AMZN.pdf, 2023 Q2 AMZN.pdf, 2023 Q3 AMZN.pdf]",154,,,
53,,Are there any significant changes in Amazon's debt structure or interest expenses across these quarters?,"Yes, there are significant changes in Amazon's debt structure and interest expenses across these quarters. 

In the ""2022 Q3 AMZN.pdf"" document, it is mentioned that as of September 30, 2022, Amazon had $66.5 billion of unsecured senior notes outstanding and $972 million of borrowings under their credit facility. The weighted-average remaining life of the Notes was 12.9 years as of September 30, 2022.

In the ""2023 Q1 AMZN.pdf"" document, it is stated that as of March 31, 2023, Amazon had $68.5 billion of unsecured senior notes outstanding and $972 million of borrowings under their credit facility. The weighted-average remaining life of the Notes was 14.0 years as of March 31, 2023.

In the ""2023 Q2 AMZN.pdf"" document, it is indicated that as of June 30, 2023, Amazon had $66.5 billion of unsecured senior notes outstanding and $972 million of borrowings under their credit facility. The weighted-average remaining life of the Notes was 13.2 years as of June 30, 2023.

In the ""2023 Q3 AMZN.pdf"" document, it is noted that as of September 30, 2023, Amazon had $66.5 billion of unsecured senior notes outstanding and $972 million of borrowings under their credit facility. The weighted-average remaining life of the Notes was 12.9 years as of September 30, 2023.

Interest expenses have also fluctuated across these quarters. For instance, in the ""2022 Q3 AMZN.pdf"" document, interest expense was reported as $617 million for the three months ended September 30, 2022. In the ""2023 Q1 AMZN.pdf"" document, interest expense was $823 million for the three months ended March 31, 2023. In the ""2023 Q2 AMZN.pdf"" document, interest expense was $840 million for the three months ended June 30, 2023. Finally, in the ""2023 Q3 AMZN.pdf"" document, interest expense was $806 million for the three months ended September 30, 2023.

These documents show that while the total face value of long-term debt has remained relatively stable at around $66.5 billion, there have been changes in the weighted-average remaining life of the Notes and fluctuations in interest expenses.",,,"[2022 Q3 AMZN.pdf, 2023 Q1 AMZN.pdf, 2023 Q2 AMZN.pdf, 2023 Q3 AMZN.pdf]",328,,,
54,,Does Amazon report any significant new business acquisitions or divestitures in these 10-Qs?,"Yes, Amazon reports significant new business acquisitions in these 10-Qs. Specifically, the acquisition of 1Life Healthcare, Inc. (""One Medical"") is mentioned in the 2023 Q1 AMZN.pdf, 2023 Q2 AMZN.pdf, and 2023 Q3 AMZN.pdf documents. The acquisition was for cash consideration of approximately $3.5 billion, net of cash acquired, to provide health care options for customers.

Additionally, in the 2023 Q3 AMZN.pdf document, there is mention of an agreement entered into in August 2022, as amended in July 2023, to acquire iRobot Corporation for approximately $1.7 billion, including its debt, subject to customary closing conditions.

No divestitures are reported in the provided 10-Qs.",,,"[2023 Q1 AMZN.pdf, 2023 Q2 AMZN.pdf, 2023 Q3 AMZN.pdf]",100,,,
55,,How have Amazon's inventory levels changed across these quarters and what might this indicate about their supply chain management?,"Amazon's inventory levels have changed as follows across the quarters:

- As of September 30, 2022, the inventory valuation allowance was $2.8 billion.
- As of December 31, 2022, the inventory valuation allowance remained at $2.8 billion.
- As of June 30, 2023, the inventory valuation allowance slightly decreased to $2.7 billion.
- As of September 30, 2023, the inventory valuation allowance further decreased to $2.6 billion.

The decrease in inventory valuation allowance from $2.8 billion to $2.6 billion over the year may indicate that Amazon has been effectively managing its inventory levels, possibly through improved inventory turnover, better demand forecasting, or more efficient supply chain management practices. This could also suggest that Amazon is maintaining a balance between having enough stock to meet customer demand without overstocking, which can lead to increased storage costs or potential write-downs for obsolete inventory.",,,"[2022 Q3 AMZN.pdf, 2023 Q1 AMZN.pdf, 2023 Q2 AMZN.pdf, 2023 Q3 AMZN.pdf]",136,,,
56,,Are there any significant changes or new disclosures in Amazon's accounting policies as reported in these 10-Qs?,"Yes, there are significant changes or new disclosures in Amazon's accounting policies as reported in the provided 10-Qs. Specifically, in the ""2023 Q1 AMZN.pdf"" document, under ""Note 1 — ACCOUNTING POLICIES AND SUPPLEMENTAL DISCLOSURES,"" it is mentioned that effective January 1, 2022, research and development expenses are required to be capitalized and amortized for U.S. tax purposes, which delays the deductibility of these expenses. This change is due to the U.S. tax reform and is a significant shift from the previous immediate expensing of research and development costs.

Additionally, in the ""2023 Q3 AMZN.pdf"" document, under ""Note 2 — FINANCIAL INSTRUMENTS,"" there is a disclosure about a new investment in a $1.25 billion note from Anthropic, PBC, which is convertible to equity. There is also an agreement to invest up to an additional $2.75 billion in a second convertible note, along with a commercial arrangement primarily for the provision of AWS cloud services and chips. This represents a new financial commitment and investment that was not disclosed in the previous 10-Qs provided.",,,"[2023 Q1 AMZN.pdf, 2023 Q3 AMZN.pdf]",171,,,